NESTLÉ INDIA LIMITED							
amended)areapplicableandaccordingly,the(vii)(a)TheCompanyisregularindepositingwith requirement to report on clause 3(iv) of the Orderappropriate authorities undisputed statutory dues is not applicable to the Company.including goods and services tax, provident fund, (v)The Company has neither accepted any depositsemployees’stateinsurance,income-tax,sales- from the public nor accepted any amounts whichtax, service tax, duty of customs, duty of excise, are deemed to be deposits within the meaning ofvalue added tax, cess and other statutory dues sections 73 to 76 of the Companies Act, 2013 (asapplicabletoit.Accordingtotheinformation amended) and the rules made thereunder, to theand explanations given to us and based on audit extent applicable. Accordingly, the requirement toproceduresperformedbyus,noundisputed report on clause 3(v) of the Order is not applicableamounts payable in respect of these statutory dues to the Company.were outstanding, at the year end, for a period of more than six months from the date they became (vi)We have broadly reviewed the books of accountpayable. maintainedbytheCompanypursuanttothe rules made by the Central Government for the(b)The dues of goods and services tax, provident maintenance of cost records under section 148(1)fund,employees’stateinsurance,income-tax, of the Companies Act, 2013 (as amended), relatedsales-tax, service tax, duty of custom, duty of to the manufacture of Milk Products and Nutrition,excise, value added tax, cess, and other statutory Prepared Dishes and Cooking aids, Powdered anddues have not been deposited on account of any Liquid Beverages and Confectionery, and are of thedispute, are as follows. opinion that prima facie, the specified accounts and records have been made and maintained. We have not, however, made a detailed examination of the same. S.Name of theNature of DuesAmountAmountPeriod to which amount relatesForum where case is pending No.Statute(` inpaid under million)protest (` in million) Honorable Supreme Court of 1Disallowance of Income Tax Act, FY 1996-97 to 2000-01, FY 1,253.2 1961royalty and other India expenses2004-05 to 2007-08 FY 2000-01 to 2003-04, FY 2Disallowance of Income Tax Act, Delhi High Court 1961royalty and other3,829.8 2008-09 to 2014-15expenses Disallowance of 805.0 royalty, other 3Income Tax Act, Income Tax Appellate Tribunal 19617,258.1FY 2015-16 to 2017-18 expenses and transfer pricing TDS and TCS FY 2014-15, FY 2016-17, FY 4claimed in ITR, Income Tax Act, Commissioner of Income Tax1961inconsistency in85.4 2020-21the deduction u/s 43B and penalty At respective state authorities Haryana – FY 2007-08-Punjab & Haryana High Court Orissa – FY 2007-08 to -Orissa High Court 2017-18 5Entry TaxEntry Tax783.5181.5West Bengal – FY 2012-13 to-West Bengal Tax Tribunal 2016-17 Uttarakhand – 2010-11 to-Uttarakhand High Court 2017-18 Madhya Pradesh – 2009-10 to-Madhya Pradesh High Court 2011-12 43							
S. No.	Name of the Statute	Nature of Dues	Amount (` in million)	Amount paid under protest (` in million)	Period to which amount relates	Forum where case is pending	
1	Income Tax Act, 1961	Disallowance of royalty and other expenses	1,253.2	805.0	FY 1996-97 to 2000-01, FY 2004-05 to 2007-08	Honorable Supreme Court of India	
2	Income Tax Act, 1961	Disallowance of royalty and other expenses	3,829.8	FY 2000-01 to 2003-04, FY 2008-09 to 2014-15	Delhi High Court		
3	Income Tax Act, 1961	Disallowance of royalty, other expenses and transfer pricing	7,258.1	FY 2015-16 to 2017-18	Income Tax Appellate Tribunal		
4	Income Tax Act, 1961	TDS and TCS claimed in ITR, inconsistency in the deduction u/s 43B and penalty	85.4	FY 2014-15, FY 2016-17, FY 2020-21	Commissioner of Income Tax		
5	Entry Tax	Entry Tax	783.5	181.5	Haryana – FY 2007-08 Orissa – FY 2007-08 to 2017-18 West Bengal – FY 2012-13 to 2016-17 Uttarakhand – 2010-11 to 2017-18 Madhya Pradesh – 2009-10 to 2011-12	At respective state authorities -Punjab & Haryana High Court -Orissa High Court -West Bengal Tax Tribunal -Uttarakhand High Court -Madhya Pradesh High Court	
